user_ID,finishTime,Q8_1: 
831553,26/04/2021 15:15,הדרך היחידה בה ניתן לבחור אידיאולוגיה ובה למפלגות יש אחריות
831592,27/04/2021 17:26,כי זה יותא אמיתי ויותר דמוקרטי כי יש לנודעות אישיוצ גם על המועמדים ולא רק על המפלגה באופן כללי וכרע אין אפשרות השפעה על בחירת המועמדים למפלגה על רק המפלגה  באופן כללי
831621,27/04/2021 22:10,אני לא חושבת שאף אחת מן השיטות מספיק טובה
832058,27/04/2021 14:35,מאפשרת ייצוג הולם לציבורים שונים ולא הופכת לפריימריז אחד ענקיים
833247,27/04/2021 23:30,.
833352,27/04/2021 16:20,מעדיפה מועמדים על פני מפלגה שלמה
833759,26/04/2021 20:38,מייצגת הכי טוב מי הכי קרוב אלי בדעות
836452,26/04/2021 21:21,כדי שלא יהיה פה שלטון מתמשך או שלטון דיקטטורי. מבחינתי שיהיו בחירות מפלגתיות; אבל שיהיה ניתן לבחור על פי דירוג אישי את הרשימה לכנסת של אותה מפלגה. כמו כן צריך שיהיו בחירות ישירות לראשות הממשלה; במסגרתם צריך לאפשר לבחור על פי דירוג של העדפה אישית ראש ממשלה שעליו יוטל הרכבת הקואליציה; במסגרת הבחירות הישירות צריך לעשות סבב שני של בחירת ראש ממשלה שבו שני המועמדים המובילים יתחרו ראש בראש. לאחר שמישהו נבחר בבחירה ישירה אחרי הסיבוב השני צריך להקל עליו בהקמת הקואליציה כי הוא הנציג של העם לאחר הסיבוב השני. צריך להגביל את כהונת ראש הממשלה ל-2 קדנציות או לשמונה שנים לכל היותר ולבטל את הדבר שנקרא ראש ממשלה חליפי; מספיק מה שהיה פעם: סגן. לחוקק חוק יסוד שאוסר על ראש ממשלה; נשיא וראש עיר גדולה לכהן עם כתב אישום. אם כל זה לא יעזור; אז אולי לנסות להעלות את אחוז החסימה; ואם גם זה לא יעזור; אז אולי לצמצם את מספר המפלגות לשניים. כל חוקי מניעת השחיתות צריכים להתחוקק בכל מקרה. צריך לחוקק חוקה שתעגן בחוק יסוד את עקרונות הדמוקרטיה המורחבים; את זכויות האדם והאזרח המורחבים; ואת צביון רוח מגילת העצמאות; ואת הפרדת הדת מהמדינה; ואת עקרונות הפרדת הרשויות והפיקוח ההדדי החיוני; ואת חוקי מניעת השחיתות הציבורית.
836722,26/04/2021 22:52,כי זה נותן לדעות שהכי נבחרות בעם להיות בממשלה ולקדם את הדעות שעל פיהן נבחרו
836729,27/04/2021 7:30,לנסות דרך חדשה
836847,27/04/2021 21:41,אנשים שונים ודעותינו שונות עלהים
837051,27/04/2021 8:48,לא יודע
838065,27/04/2021 9:11,לא יודעת 
838520,26/04/2021 15:06,אפשר לייצב את דעותיך השונות ולהצביע למספר מועמדים חיוביים בעיניך גם אם הם מפוזרים במפלגות שונות
839474,27/04/2021 20:01,ככה החלטה לא על בן אדם אחד אלא על צוות
839553,27/04/2021 21:37,אולי. יערה אישית כיון שכח שיטה אחרת תביא למצב הקייים שהוא בלתי נסבל
839919,26/04/2021 14:58,אני כבר לא יודע מה אני מעדיף
842557,27/04/2021 11:00,לא משנה לי
843280,26/04/2021 16:06,אין ברירה ככה נגיע לבחירות עשיריות 
843335,27/04/2021 7:41,בחירה אישית היא הכי מדוייקת
843427,26/04/2021 17:18,רגיל להצביע ככה
843522,26/04/2021 16:42,מתאים ביותר לתקופה 
848822,26/04/2021 20:54,כי יש יותר מדי מפלגות
848840,26/04/2021 15:10,..
849095,27/04/2021 21:28,מבלבל
849338,26/04/2021 15:00,השיטה מאפשרת לכל אחד להשפיע על זהות הממשלה וערכיה; גם אם המפלגה בה בחר לא זכתה בבחירות
850138,27/04/2021 22:31,כי זו דעתי
850994,26/04/2021 19:44,כדי שלא יהיו הפתעות לאחר הבחירות
852731,26/04/2021 21:49,הכי תואם בשלב זה
852869,26/04/2021 23:52,ככה יש אופציה לבחור במועמד מסויים שהוא לא בהכרח יו&quot;ר הסיעה; ויכול למנוע סכסוכים פוליטיים ולקדם הקמת ממשלה באופן מהיר יותר
852940,26/04/2021 14:56,יותר ספציפית..מצד דני נותנת אפשרות לכל אחד להתבטא ולהשפיע על המפלגה שבוחר
868074,26/04/2021 22:53,כי המועמד הוא הקובע לא המפלגה
868526,27/04/2021 7:05,בשיטה זו; הציבור באמת בוחר את נבחריו; נבחרי העם; ולא הפוליטיקאים שמכתיבים לעם את הרכב המפלגות וסדר המקומות של חבריהם.
869583,26/04/2021 16:52,לא תלויים בדילים פוליטיים 
869628,27/04/2021 13:29,זה מה שאנחנו רגילים אליו. בגלל שהמצב במדינה רגיש מבחינת הבחירות וגם מכל מיני סיבות אחרות; יהיה קשה ומסובך להתחיל עם שיטת בחירות אחרת שכולם יקבלו
876053,28/04/2021 6:08,לא החלטתי
876188,26/04/2021 17:50,לא הכי מבינה בזה
876979,27/04/2021 22:11, מתלבטת
878171,28/04/2021 7:06,יותר נוח וככה כולם יצאו להצביע
878363,26/04/2021 14:52,ועאטוע
878452,27/04/2021 10:11,יותר קל להזדהות עם מועמד מאשר עם מפלגה; ובנוסף זה מקדם את הסיכויים שלו להיכנס לכנסת
878457,27/04/2021 22:45,כי מענין אותנו בסוף מי ראש הממשלה
879818,26/04/2021 20:38,כי מי שבאמת מקבל הכי הרבה קולות הוא הכי מתאים ולא מנסה בכל פעם לריב עם מלגות כאלו ואחרות ליצור רוב של 61. במצב שלא כזה ראש ממשלה יכול לכהן גם אם רוב העם לא רוצה אותו
879843,26/04/2021 17:54,בחירות אישיות לא הצליחו בעבר
881028,27/04/2021 19:21,קשה לבחור
881092,26/04/2021 16:20,הכי טובה
888356,26/04/2021 15:14,בחירות לראשות הממשלה
888435,27/04/2021 6:40,השיטה כיום לאובילה להכרעה ;לכן עדיף בחירה ישירה
894592,27/04/2021 22:23,יותר רלוונטי
898686,27/04/2021 22:12,לא בטוחה מה עדיף 
899612,26/04/2021 15:32,השיטה מייצגת יותר את הדעה שלי
899626,27/04/2021 22:08,השיטה הכי דמוקרטית
910401,26/04/2021 17:59,לא תמיד המצביעים אוהבים את הרכב הרשימה או את מנהיגה אבל עדיין מאמינים באיד' של המפלגה
911324,27/04/2021 15:23,כי שיטת הבחירות שלנו לצערנו לא נותנת ממשלה כרגע
912081,26/04/2021 17:49,מתלבט
912195,26/04/2021 16:38,השיטה הכי טובה למדינה שלנו
913007,27/04/2021 21:11,מה שרוצים זה מה שבוחרים
913022,27/04/2021 21:47,יבחר המתמודד הטוב ביותר על ידי העם ולא רק לפי פריימריז במפלגה
913400,26/04/2021 15:10,מכיר
914396,27/04/2021 13:13,אני עדיין מתלבטת 
914550,27/04/2021 19:22,ניראהה לי ש/זה הכי פאייר לתושבים
915023,26/04/2021 15:32,לצפלגה הגדולה יהיה את הכוח והאפשרות לממשלה יציבה
915072,27/04/2021 12:00,שיהיה אאפשר לשנות את כולם במפלגות 
915188,26/04/2021 22:50,בחירות מועמדים
915727,26/04/2021 15:19,המועמד הוא החשוב המפלגה פחות
915780,26/04/2021 20:17,לא יודע ככה נראה לי
916185,27/04/2021 23:32,העומד בראש המפלגה וחברי מפלגתו מקבלים קולות ועל פי מספר הקולות הם מקבלים מנדטים לייצוג בכנסת
916354,26/04/2021 20:35,אני נוטה להזדהות עם ערכים של מפלגה ולא של אדם.
917353,26/04/2021 15:14,לא בטוחה מה השיטה העדיפה
917388,26/04/2021 17:49,They have Israels best interests at heart and won't give any more land away
917472,26/04/2021 18:49,מצביעם למנהיג
917746,27/04/2021 23:36,לא יודעת
918701,26/04/2021 15:28,יותר נוח
919204,26/04/2021 17:09,לא מצליח להחליט איזו שיטה עדיפה
921364,27/04/2021 21:22,בוחרי מפלגה בוחרים את הראש
922549,27/04/2021 22:18,הכי טובה
922880,27/04/2021 10:16,רגילה לשיטה הזו
923243,27/04/2021 12:46,כרגע זה הפיתרון
929888,27/04/2021 21:10,בוחרים באופן ישיר את מי שרוצים שינהיג את המדינה
932156,27/04/2021 20:51,זו הדמוקרטיה הנהוגה בישראל ואין סיבה לשנות אותה. עד היום זה התנהל בצורה חלקה. עדיף להצביע למפלגה שלמה שמביאה את דעותייך מאשר לאדם אחד 
932440,27/04/2021 2:56,השאר זה ספין לא ריאלי שמשמש רק את ביבי
932919,27/04/2021 21:03,לא ברור לי מה עדיף
938311,26/04/2021 15:18,עקב ריבוי המפלגות
942799,26/04/2021 15:19,לאור המצב שנוצר בו לא מתאפשר למפלגה שזכתה ברוב הקולות להרכיב ממשלה . מצב שיכול לגרום למועמד שלא זכה ברוב הקולות להרכיב ממשלה. מצב לא דמוקרטי לחלוטין. אינו משקף את עמדת הרוב בציבור
953685,27/04/2021 11:05,כל אדם אינדבודאל
954168,26/04/2021 14:56,ככה יהיה אפשר להבין איך רוצים שהמדינה תתנהל פחות או יותר
957319,26/04/2021 16:23,אולי במצב הנוכחי צריך שילוב של בחירות מפלגתיות ובחירות ישירות לראשות הממשלה. זה לא אידיאלי.  אבל במצב הנוכחי זה יכול להוציא אותנו מהפלונטר
958187,26/04/2021 17:30,יותר מחויבות של הנציג לבוחר
961620,26/04/2021 18:32,מוכר לעם
961974,27/04/2021 10:07,דמוקרטיה
968458,27/04/2021 16:53,יותר מדויקת
1058070,27/04/2021 21:42,כך ניתן להצביע למועמד המועדף
1059475,26/04/2021 15:34,סכנה שביבי ייקח
1059587,27/04/2021 6:06,היא נותנת אפשרות להצביע למפלגה שהכי קרובה לדעותך. 
1059635,27/04/2021 20:58,לא יודעת מה עדיף 
1059882,27/04/2021 9:04,כי אי אפשר לשנות כל פעם את חוקי המשחק
1061083,27/04/2021 6:45,לא בטוח
1062182,27/04/2021 8:05,שינוי
1062237,27/04/2021 18:54,ככה אני מכיר
1062714,27/04/2021 9:32,לא יודע נו הכל אותו חרא
1064085,26/04/2021 19:39,בחירת מפלגה
1064661,26/04/2021 15:13,הכי מייצגת את דעות המצביעים
1067281,27/04/2021 14:51,ימנע מראש מפלגה עם מספר המנדטים הגבוה ביותר לחבר אליו מפלגות נוספות לקואליציה. 
1069403,26/04/2021 16:01,רשימה היא מפלגה שלמה ולא מועמד אחד
1109175,27/04/2021 13:49,ככה חושב
1109995,27/04/2021 10:49,מאפשרת החלטה בדרך המהירה ביותר
1110061,26/04/2021 19:25,גבכהענימחצ
1110253,27/04/2021 22:15,פותרת את הבעיה של בחירות חוזרות ויוצרת ממשלה יציבה
1123691,27/04/2021 15:15,אני לא בטוחה מהי שיטת הבחירות הטובה ביותר
1124827,26/04/2021 15:22,את מי שרוצים רק הוא יהחר
1125301,27/04/2021 22:02,מתלבטת
1130155,27/04/2021 21:01,.
1135881,27/04/2021 12:18,מתלבט..
1137740,27/04/2021 1:08,לא יודע
1140616,27/04/2021 21:00,השיטה הנהוגה כיום בעייתית בגלל ריבוי המפלגות הקיים בישראל; מתקשה לומר איזו שיטה עדיפה יותר מהאופציות הנוספות
1140618,26/04/2021 16:08,בווחרים מי  ייכנס
1142172,27/04/2021 18:47,לאיטגית מ
1142855,27/04/2021 13:40,כמו בכל המדינות בעולם
1144341,27/04/2021 19:28,כך כולם בטוחים מי קיבל את מספר הקולות הגבוה ביותר ולא נסחבים ל4 מערכות בחירות מיותרות ויקרות
1144546,26/04/2021 15:05,פחות סחטנות
1144608,27/04/2021 10:06,תוצאות אמיתיות יותר
1144702,27/04/2021 18:25,1
1144752,27/04/2021 21:34,לא יודעת
1145178,26/04/2021 15:59,מכיוון שאנחנו בבחירות רביעיות והשיטה הקיימת אינה טובה
1145351,27/04/2021 17:49,הכי קל
1146376,26/04/2021 14:59,פחות מורכב
1157744,26/04/2021 18:45,נותן ייצוג הוגן לכל חלקי האוכלוסיה
1157881,27/04/2021 15:21,מפני שזה משקף את את רצון הבוחר עם אלטרנטיבה; בנוסף אם הזוכה לא הצליח להקים ממשלה; נתן להטיל את המנדט על הבא בתור ללא סחטנות.
1169730,27/04/2021 6:45,מצביעים ישירות מי יהיה הנהיג בלי משחקים
1170127,27/04/2021 12:27,כי זו השיטה הנוחה ביותר
1177864,27/04/2021 6:43,עדיף להצביע על סמך אידיולוגיה מאשר על סמך אהדה לאדם ספציפי.
1178436,26/04/2021 21:37,הרבה יותר ייצוג וכוח לכל אזרח; אולי גם ימנע שחיתות
1180895,27/04/2021 8:20,לא יהיה צורך בבחירות נוספות
1181866,27/04/2021 19:55,כי אז אי אפשר לומר למועמד שיזוז.כי העם בחר בו באופן ברור מתמיד
1181961,27/04/2021 12:57,מתלבט
1182133,26/04/2021 19:12,השיטה האישית עלולה ליצור מצב של ראש ממשלה לא מתפקד; כי כלל הממשלה מתנועה אחרת
1192542,26/04/2021 19:09,יצוג לפי מ]לגה בכנסת לדעתי הכי מתאים לארץ
1199510,27/04/2021 21:29,לא יודעת
1200459,26/04/2021 21:13,לא רלונטי
1200740,26/04/2021 20:12,בבחירות אישיות האזרח יכול לבחור את המועמד המתאים לערכים ולאידיאולוגיה שלו בלי לבחור את שאר מועמדי המפלגה שלו
1202962,26/04/2021 17:12,.
1205320,27/04/2021 22:31,לא בטוחה
1205410,27/04/2021 23:46,כי זה יפתור את כל הפלונטר הפוליטי ובסופו של דבר הרב אנשים מצביעים למפלגה מסוימת רק בגלל מי שעומד בראשה וגם אנשים שהצביעו למפלגה אחרת מהגוש למשל מגוש הימין עדיין רוצים את ביבי כראש ממשלה; זה יהיה הכי נכון.
1208348,27/04/2021 9:20,לא יודעת
1208602,26/04/2021 14:59,כי כל אחד יש לו סיכוי להרכיב ממשלה וזה הופך את זה ליותר מעניין ומסקרן כי אי אפשר לנחש מה יקרה
1209588,27/04/2021 9:04,כי אנו בוחרים ישירות את המועמד שלדעתנו מתאים להיות ראש הממשלה
1210079,26/04/2021 19:14,כי נמאס ממירי רגב
1210670,27/04/2021 9:11,לא יודעת 
1214771,26/04/2021 14:53,יפחית את הכאב ראש של הרכבת קואליציה
1215555,27/04/2021 16:14,לדעתי יהיו יותר אנשים יצביעו וגם האחריות למספר המנדטים תיפול על כל אנשי המפלגה כי ירצו שיבחרו בהם
1231327,26/04/2021 17:24,צודקת
1270845,27/04/2021 8:58,המדינה זקוקה למנהיגים; מי שנמצא היום ברישמות &quot;פרווה&quot; 
1271089,26/04/2021 18:37,נראה לי יותר טובה
1271380,28/04/2021 6:21,העם בוחר את מי שבעיניו הכי מתאים להיות ראש ממשלה וכך אין בעייה בהקמת ממשלה ובחירות נוספות
1271388,27/04/2021 23:24,רצוי לבחור ראש ממשלה כי לא תמיד המועמדים במפלגה שלו גם טובים ומתאימים לדעותי
1271391,26/04/2021 20:27,זה מונע בחירות כל כמה חודשים ומונע מספר רב של מפלגות
1271401,27/04/2021 14:56,חמניונימ
1271490,27/04/2021 21:49,תאמת עדיף בחירות כמו באמריקה שבוחרים במפלגה ולפני המחוז מקבלים קולות כולם אם יש רוב קולות
1272637,28/04/2021 0:14,הכי נראה לי סביר
1272705,27/04/2021 22:07,כך אפשר להקים ממשלה 
1272766,27/04/2021 11:41,הכי טוב ככה
1272918,26/04/2021 15:07,שיטה שעובדת הרבה שנים; דמוקרטית ולא רואה מדוע לשנות אותה
1273085,26/04/2021 14:52,כך ניתן לבחור ספציפית במועמד אותו רוצים
1273342,27/04/2021 9:39,לא מספיק מבינה את השיטות האישיות. צריך להסביר על זה בצורה יותר ברורה ולעומק
1273383,26/04/2021 15:19,כוחו של הרגל
1273504,27/04/2021 6:55,בוחרים במי שרוצים
1274723,27/04/2021 22:20,כי זו שיטה שחוסכת את המושג של פריימריז וכל הבאלגן של הרכבת רשימהונותנת לי להצביע יוצא בקלות למפלגה למרות שאני לא אוהב אותה כי אני מצביע למועמד מסויים בתוכה
1274837,26/04/2021 16:33,דמורקטיה של כל העם למען מפלגה אחת ולא לעמן אחד שהוא כמו ראיס (סגנון ביבי שנהפך להיות &quot;מלך בלתי מעורער&quot;) כשהוא מעורער בנפשו
1275863,27/04/2021 21:09,השיטה הנוכחית בטוח לא עובדת; עובדתית היא נכשלה 4 פעמים וההמשך עוד יבוא... יש ריבוי מפלגות ואני מאמינה שהשיטה הזו תצמצם את כמות המפלגות ותאחד את המועמדים לתוך בעיקר. 
1277448,27/04/2021 22:21,ככה ניתן לשקלל טוב יותר את המועמדים
1277852,27/04/2021 12:25,לבטא את רצון הבוחר באופן האולטימטיבי ביותר. כאשר האזרח הקטן יבחר במועמד שלו לראשות הממשלה ושאר מועמדים חפי עשייתם ולא עפ?י פוליטיקה זולה; פופוליסטית וסגירת דילים מאחורי הקלאים או שיריונים. שתהיינה אפשרות לכל אזרח לקבוע מי המועמד שלו שהוא יירצה שהוא ייצג אותו בכנסת; לא רק בראשות הממשלה. גם בחירת ח?כ זה חשוב; בכדי ליצור שינוי בחלוקת התיקים. ח?כ מעולים לא מקבלים תפקיד שר בגלל הבטחות בחירות של מנהיג המפלגה; למרות שבמצב אחר הם היו יכולים לנהל תיקי ממשלה מסוימים בצורה הרבה יותר טובה מאלה שמכהנים כיום בגלל שריונים או הבטחות כאלה ואחרות
1279969,26/04/2021 14:58,פשוטה יותר; מאפשרת השפעה על המועמדים דרך פריימריז. מונעת סחטנות אישית של חברי כנסת שלא מחוייבים לסיעה. 
1280077,26/04/2021 17:40,ם
1281180,27/04/2021 13:56,לא יודעת
1281355,27/04/2021 7:25,צריך לעשות כמו בארהב 2 מפלגות וזהו
1281715,26/04/2021 17:42,מתלבטת
1281745,26/04/2021 15:26,הכי פשוטה
1281804,26/04/2021 19:47,לבחור אנשים איכותיים שיצטרכו לתת דין וחשבון לבוחר
1281820,27/04/2021 22:10,השיטה כיום לא עובדת
1281826,27/04/2021 10:12,מוריד מהכוח של המפלגות על השלטון הרצוי
1281857,27/04/2021 8:26,אפשר למנוע מצב הנוכחי
1281874,27/04/2021 22:23,רמת דיוק
1282082,27/04/2021 22:31,כי זה הכי דמוקרטי
1282357,27/04/2021 22:44,חושבת שהיא עדיפה. הודעת יותר מייצגת יותר את העם ודמוקרטית יותר
1282410,26/04/2021 15:16,הכי משקף - צריך להעלות את אחוז החסימה 
1284008,27/04/2021 17:22,שיטה טובה
1284316,27/04/2021 1:10,הבחירות לא מתקדמות; והם הפכו להיות סביב בן אדם ולא סביב מפלגה. לכן נכון יותר לעשות בחירות סביב האנשים במפלגות
1284948,26/04/2021 15:57,בחירה ישירה נכשלה
1285094,27/04/2021 11:39,המועמד הרצוי נבחר
1285223,27/04/2021 14:41,ככה אפשר להצביע למישהו שאתה מאמין בו בצד הפוליטי שאתה מאמין בו.. אני ימני; אבל לעולם לא אצביע ליכוד כל עוד ביבי בראש המפלגה.
1285918,26/04/2021 23:41,כי לא בטוח שמועמדים נוספים יהיו ברמה של ראשי ממשלה ויהיה קשה לדרג אותם 
1286157,27/04/2021 21:47,מכיוון שיש יותר מידי מפלגות ומועמדים ואי אפשר להגיע לאחוז המתאים על מנת שמישהו יבחר ולבחור מכל מפלגה אחד זה לא מתאים לכל אחד יש צדדים או שמאל או ימין אי אפשר ביחד
1286580,27/04/2021 18:58,אני ממש לא מבינה בזה ולא מצביעה בבחירות כי נמאס לי כל השטויות האלו
1288781,27/04/2021 21:59,אי אפשר לרמות 
1288797,27/04/2021 9:17,הכי חשוב לבחור את הנציג ולא את המפתגה
1289071,27/04/2021 21:21,לאפשר להיות מעורבים בבחירת הכי טובים בכל רשימה
1290576,26/04/2021 16:58,פחות כח לקטנות לסחוט
1297437,26/04/2021 16:05,כך העם יבחר ישירות את מי שהוא חושב שמתאים לפי סדר העדיפות שלו
1297682,27/04/2021 21:39,אפשר לראות את מי רוצים לראות כראש הממשלה
1297733,27/04/2021 15:13,משום שנכון לרגע זה; הבעיה לדעתי איננה השיטה; אלא התנהלות המפלגות באופן לא דמוקרטי והנציגים עצמם. שום שיטה לא תשנה את זה. זה משבר שצריך להתמודד איתו בכלים הקיימים. כמו כן; השיטות האישיות רק מאדירות את פולחן היחיד שזו גם ככה חלק מהבעיה
1300718,26/04/2021 21:51,שלא ההיו בחירות חמשיות 
1301065,27/04/2021 10:08,למרות שאנחנו במצב של שיתוק בעם; היא תוציא הכי הרבה אנשים להצביע והכי דומה להתפלגות בעם
1301554,26/04/2021 15:18,כי בסופו של יום; הבחירה העומדת בפני האזרח איננה רק אדם אחד אלא מכלול המועמדים שיאיישו כקבוצה את הנהגת המדינה.אם יורשה לי הייתי מציע שיטה אחרת; והיא:הבחירות המדרגות את כלל המועמדים הינו טוב לבית המחוקקים; אך עדיין לא יתן פיתרון למשילות יעילה; לדעתי צריך לבחור בנוסף ובמקביל לבחירות להרכבו של &quot;בית המחוקקים&quot;; בחירות לראשות ממשלה; כתוצאה מהן יוכל להרכיב ממשלה מקצועית/ פוליטית כראות עיניו; ממשלה שתוכל לנהל את ענייניה הביצועיים של המדינה ללא צורך באישורו של בית המחוקקים; כאשר את סמכותה היא יונקת ישירות מבחירת העם; היא עדיין תזדקק להתאזן מול בית המחוקקים על מנת לקבל את החקיקה הראויה למדיניות שהיא חפצה להפעיל; משהו בין סגנון הממשל הנשיאותי של ארה&quot;ב לזה של הרפובליקה החמישית הצרפתית (שאגב; המציאה והפעילה שיטה זו בעקבות משבר המשילות שהיה נחלתה של הרפובליקה הרביעית בשלהי שנות השישים של המאה העשרים).הנושא של בחירות אזוריות שהמנצח לוקח (למעשה) את כל הקולות יש בו יתרונות (למשילות) אך לדעתי אם אפשר להסתדר בלעדיו (וצריך לנסות) כדאי לוותר עליו מאחר והוא חוטא לעיקרון היצוגיות..
1301633,26/04/2021 16:37,בחירה שתביא להכי הרבה פחות מחלוקות
1302468,27/04/2021 8:17,אין לי ממש דיעה
1302524,27/04/2021 21:37,משאירה את הדמוקרטיה כמו שהיא בלי מקום לשחיתויות
1313520,26/04/2021 15:01,זו שיטה שבה מצביעים לרעיון. כמו כן; אינני רואה כיצד השיטות האחרות עדיפות על המצב הפוליטי בזמן האחרון.
1337082,26/04/2021 19:46,רק זה יוציא אותנו מהפלונטר
1337093,27/04/2021 20:58,ככה עדיף . 
1337214,27/04/2021 21:30,אני חושבת שמה שיש כרגע יעבוד הכי טוב; בחירות שיש יותר אפשרות בחירה תפזר את האנשים ותבלבל אותם יותר.
1337221,26/04/2021 18:20,רעיון מבורך
